Poster_Link,Series_Title,Released_Year,Certificate,Runtime,Genre,IMDB_Rating,Overview,Director,Star1,Star2,Star3,Star4,No_of_Votes,Gross
"https://m.media-amazon.com/images/M/MV5BMTQ4MzQzMzM2Nl5BMl5BanBnXkFtZTgwMTQ1NzU3MDI@._V1_UY98_CR1,0,67,98_AL_.jpg",Dangal,2016,U,161,"Action, Biography, Drama",8.4,Former wrestler Mahavir Singh Phogat and his two wrestler daughters struggle towards glory at the Commonwealth Games in the face of societal oppression.,Nitesh Tiwari,Aamir Khan,Sakshi Tanwar,Fatima Sana Shaikh,Sanya Malhotra,156479,12391761.0
"https://m.media-amazon.com/images/M/MV5BMDhjZWViN2MtNzgxOS00NmI4LThiZDQtZDI3MzM4MDE4NTc0XkEyXkFqcGdeQXVyMTMxODk2OTU@._V1_UY98_CR1,0,67,98_AL_.jpg",Taare Zameen Par,2007,U,165,"Drama, Family",8.4,"An eight-year-old boy is thought to be a lazy trouble-maker, until the new art teacher has the patience and compassion to discover the real problem behind his struggles in school.",Aamir Khan,Amole Gupte,Darsheel Safary,Aamir Khan,Tisca Chopra,168895,1223869.0
"https://m.media-amazon.com/images/M/MV5BMGFkNWI4MTMtNGQ0OC00MWVmLTk3MTktOGYxN2Y2YWVkZWE2XkEyXkFqcGdeQXVyNjU0OTQ0OTY@._V1_UX67_CR0,0,67,98_AL_.jpg",Once Upon a Time in America,1984,A,229,"Crime, Drama",8.4,"A former Prohibition-era Jewish gangster returns to the Lower East Side of Manhattan over thirty years later, where he once again must confront the ghosts and regrets of his old life.",Sergio Leone,Robert De Niro,James Woods,Elizabeth McGovern,Treat Williams,311365,5321508.0
"https://m.media-amazon.com/images/M/MV5BNDQwODU5OWYtNDcyNi00MDQ1LThiOGMtZDkwNWJiM2Y3MDg0XkEyXkFqcGdeQXVyMDI2NDg0NQ@@._V1_UX67_CR0,0,67,98_AL_.jpg",Witness for the Prosecution,1957,U,116,"Crime, Drama, Mystery",8.4,A veteran British barrister must defend his client in a murder trial that has surprise after surprise.,Billy Wilder,Tyrone Power,Marlene Dietrich,Charles Laughton,Elsa Lanchester,108862,8175000.0
"https://m.media-amazon.com/images/M/MV5BMmExYWJjNTktNGUyZS00ODhmLTkxYzAtNWIzOGEyMGNiMmUwXkEyXkFqcGdeQXVyNjU0OTQ0OTY@._V1_UX67_CR0,0,67,98_AL_.jpg",The Great Dictator,1940,Passed,125,"Comedy, Drama, War",8.4,Dictator Adenoid Hynkel tries to expand his empire while a poor Jewish barber tries to avoid persecution from Hynkel's regime.,Charles Chaplin,Charles Chaplin,Paulette Goddard,Jack Oakie,Reginald Gardiner,203150,288475.0
"https://m.media-amazon.com/images/M/MV5BZWZhMjhhZmYtOTIzOC00MGYzLWI1OGYtM2ZkN2IxNTI4ZWI3XkEyXkFqcGdeQXVyNDAzNDk0MTQ@._V1_UY98_CR0,0,67,98_AL_.jpg",Andhadhun,2018,UA,139,"Crime, Drama, Music",8.3,"A series of mysterious events change the life of a blind pianist, who must now report a crime that he should technically know nothing of.",Sriram Raghavan,Ayushmann Khurrana,Tabu,Radhika Apte,Anil Dhawan,71875,1373943.0
"https://m.media-amazon.com/images/M/MV5BZmM0NGY3Y2MtMTA1YS00YmQzLTk2YTctYWFhMDkzMDRjZWQzXkEyXkFqcGdeQXVyNTA4NzY1MzY@._V1_UX67_CR0,0,67,98_AL_.jpg",Ikiru,1952,Not Rated,143,Drama,8.3,A bureaucrat tries to find a meaning in his life after he discovers he has terminal cancer.,Akira Kurosawa,Takashi Shimura,Nobuo Kaneko,Shin'ichi Himori,Haruo Tanaka,68463,55240.0
"https://m.media-amazon.com/images/M/MV5BNmI1ODdjODctMDlmMC00ZWViLWI5MzYtYzRhNDdjYmM3MzFjXkEyXkFqcGdeQXVyMTMxODk2OTU@._V1_UY98_CR0,0,67,98_AL_.jpg",Ladri di biciclette,1948,Not Rated,89,Drama,8.3,"In post-war Italy, a working-class man's bicycle is stolen. He and his son set out to find it.",Vittorio De Sica,Lamberto Maggiorani,Enzo Staiola,Lianella Carell,Elena Altieri,146427,332930.0
"https://m.media-amazon.com/images/M/MV5BODA4ODk3OTEzMF5BMl5BanBnXkFtZTgwMTQ2ODMwMzE@._V1_UX67_CR0,0,67,98_AL_.jpg",M - Eine Stadt sucht einen Mörder,1931,Passed,117,"Crime, Mystery, Thriller",8.3,"When the police in a German city are unable to catch a child-murderer, other criminals join in the manhunt.",Fritz Lang,Peter Lorre,Ellen Widmann,Inge Landgut,Otto Wernicke,143434,28877.0
"https://m.media-amazon.com/images/M/MV5BZjhhMThhNDItNTY2MC00MmU1LTliNDEtNDdhZjdlNTY5ZDQ1XkEyXkFqcGdeQXVyNjc1NTYyMjg@._V1_UX67_CR0,0,67,98_AL_.jpg",The Kid,1921,Passed,68,"Comedy, Drama, Family",8.3,"The Tramp cares for an abandoned child, but events put that relationship in jeopardy.",Charles Chaplin,Charles Chaplin,Edna Purviance,Jackie Coogan,Carl Miller,113314,5450000.0
"https://m.media-amazon.com/images/M/MV5BYjg2ZDI2YTYtN2EwYi00YWI5LTgyMWQtMWFkYmE3NmJkOGVhXkEyXkFqcGdeQXVyODE5NzE3OTE@._V1_UY98_CR0,0,67,98_AL_.jpg",Chhichhore,2019,UA,143,"Comedy, Drama",8.2,"A tragic incident forces Anirudh, a middle-aged man, to take a trip down memory lane and reminisce his college days along with his friends, who were labelled as losers.",Nitesh Tiwari,Sushant Singh Rajput,Shraddha Kapoor,Varun Sharma,Prateik,33893,898575.0
"https://m.media-amazon.com/images/M/MV5BMWU4ZjNlNTQtOGE2MS00NDI0LWFlYjMtMmY3ZWVkMjJkNGRmXkEyXkFqcGdeQXVyNjE1OTQ0NjA@._V1_UY98_CR0,0,67,98_AL_.jpg",Uri: The Surgical Strike,2018,UA,138,"Action, Drama, War",8.2,"Indian army special forces execute a covert operation, avenging the killing of fellow army men at their base by a terrorist group.",Aditya Dhar,Vicky Kaushal,Paresh Rawal,Mohit Raina,Yami Gautam,43444,4186168.0
"https://m.media-amazon.com/images/M/MV5BMTYzODg0Mjc4M15BMl5BanBnXkFtZTgwNzY4Mzc3NjE@._V1_UY98_CR2,0,67,98_AL_.jpg",Talvar,2015,UA,132,"Crime, Drama, Mystery",8.2,An experienced investigator confronts several conflicting theories about the perpetrators of a violent double homicide.,Meghna Gulzar,Irrfan Khan,Konkona Sen Sharma,Neeraj Kabi,Sohum Shah,31142,342370.0
"https://m.media-amazon.com/images/M/MV5BOGNlNmRkMjctNDgxMC00NzFhLWIzY2YtZDk3ZDE0NWZhZDBlXkEyXkFqcGdeQXVyODIwMDI1NjM@._V1_UX67_CR0,0,67,98_AL_.jpg",Baahubali 2: The Conclusion,2017,UA,167,"Action, Drama",8.2,"When Shiva, the son of Bahubali, learns about his heritage, he begins to look for answers. His story is juxtaposed with past events that unfolded in the Mahishmati Kingdom.",S.S. Rajamouli,Prabhas,Rana Daggubati,Anushka Shetty,Tamannaah Bhatia,75348,20186659.0
"https://m.media-amazon.com/images/M/MV5BYmJhZmJlYTItZmZlNy00MGY0LTg0ZGMtNWFkYWU5NTA1YTNhXkEyXkFqcGdeQXVyODE5NzE3OTE@._V1_UY98_CR0,0,67,98_AL_.jpg",Drishyam,2015,UA,163,"Crime, Drama, Mystery",8.2,"Desperate measures are taken by a man who tries to save his family from the dark side of the law, after they commit an unexpected crime.",Nishikant Kamat,Ajay Devgn,Shriya Saran,Tabu,Rajat Kapoor,70367,739478.0
"https://m.media-amazon.com/images/M/MV5BNWYyOWRlOWItZWM5MS00ZjJkLWI0MTUtYTE3NTI5MDAwYjgyXkEyXkFqcGdeQXVyODE5NzE3OTE@._V1_UY98_CR0,0,67,98_AL_.jpg",Queen,2013,UA,146,"Adventure, Comedy, Drama",8.2,A Delhi girl from a traditional family sets out on a solo honeymoon after her marriage gets cancelled.,Vikas Bahl,Kangana Ranaut,Rajkummar Rao,Lisa Haydon,Jeffrey Ho,60701,1429534.0
"https://m.media-amazon.com/images/M/MV5BMTY1Nzg4MjcwN15BMl5BanBnXkFtZTcwOTc1NTk1OQ@@._V1_UY98_CR0,0,67,98_AL_.jpg",Bhaag Milkha Bhaag,2013,U,186,"Biography, Drama, Sport",8.2,The truth behind the ascension of Milkha Singh who was scarred because of the India-Pakistan partition.,Rakeysh Omprakash Mehra,Farhan Akhtar,Sonam Kapoor,Pawan Malhotra,Art Malik,61137,1626289.0
"https://m.media-amazon.com/images/M/MV5BNzgxMzExMzUwNV5BMl5BanBnXkFtZTcwMDc2MjUwNA@@._V1_UY98_CR0,0,67,98_AL_.jpg",Udaan,2010,UA,134,Drama,8.2,"Expelled from his school, a 16-year old boy returns home to his abusive and oppressive father.",Vikramaditya Motwane,Rajat Barmecha,Ronit Roy,Manjot Singh,Ram Kapoor,42341,7461.0
"https://m.media-amazon.com/images/M/MV5BNTgwODM5OTMzN15BMl5BanBnXkFtZTcwMTA3NzI1Nw@@._V1_UY98_CR0,0,67,98_AL_.jpg",Paan Singh Tomar,2012,UA,135,"Action, Biography, Crime",8.2,"The story of Paan Singh Tomar, an Indian athlete and seven-time national steeplechase champion who becomes one of the most feared dacoits in Chambal Valley after his retirement.",Tigmanshu Dhulia,Irrfan Khan,Mahie Gill,Rajesh Abhay,Hemendra Dandotiya,33237,39567.0
"https://m.media-amazon.com/images/M/MV5BYThmZDA0YmQtMWJhNy00MDQwLTk0Y2YtMDhmZTE5ZjhlNjliXkEyXkFqcGdeQXVyODE5NzE3OTE@._V1_UY98_CR1,0,67,98_AL_.jpg",Rang De Basanti,2006,UA,167,"Comedy, Crime, Drama",8.2,"The story of six young Indians who assist an English woman to film a documentary on the freedom fighters from their past, and the events that lead them to relive the long-forgotten saga of freedom.",Rakeysh Omprakash Mehra,Aamir Khan,Soha Ali Khan,Siddharth,Sharman Joshi,111937,2197331.0
"https://m.media-amazon.com/images/M/MV5BNTI5MmE5M2UtZjIzYS00M2JjLWIwNDItYTY2ZWNiODBmYTBiXkEyXkFqcGdeQXVyNjQ2MjQ5NzM@._V1_UY98_CR0,0,67,98_AL_.jpg",Black,2005,U,122,Drama,8.2,"The cathartic tale of a young woman who can't see, hear or talk and the teacher who brings a ray of light into her dark world.",Sanjay Leela Bhansali,Amitabh Bachchan,Rani Mukerji,Shernaz Patel,Ayesha Kapoor,33354,733094.0
"https://m.media-amazon.com/images/M/MV5BYzExOTcwNjYtZTljMC00YTQ2LWI2YjYtNWFlYzQ0YTJhNzJmXkEyXkFqcGdeQXVyNjQ2MjQ5NzM@._V1_UY98_CR0,0,67,98_AL_.jpg","Swades: We, the People",2004,U,210,Drama,8.2,A successful Indian scientist returns to an Indian village to take his nanny to America with him and in the process rediscovers his roots.,Ashutosh Gowariker,Shah Rukh Khan,Gayatri Joshi,Kishori Ballal,Smit Sheth,83005,1223240.0
"https://m.media-amazon.com/images/M/MV5BODI2ZjVlMGQtMWE5ZS00MjJiLWIyMWYtMGU5NmIxNDc0OTMyXkEyXkFqcGdeQXVyMTQ3Njg3MQ@@._V1_UX67_CR0,0,67,98_AL_.jpg",Dom za vesanje,1988,R,142,"Comedy, Crime, Drama",8.2,"In this luminous tale set in the area around Sarajevo and in Italy, Perhan, an engaging young Romany (gypsy) with telekinetic powers, is seduced by the quick-cash world of petty crime, which threatens to destroy him and those he loves.",Emir Kusturica,Davor Dujmovic,Bora Todorovic,Ljubica Adzovic,Husnija Hasimovic,26402,280015.0
"https://m.media-amazon.com/images/M/MV5BMDgwODNmMGItMDcwYi00OWZjLTgyZjAtMGYwMmI4N2Q0NmJmXkEyXkFqcGdeQXVyNzY1MTU0Njk@._V1_UY98_CR1,0,67,98_AL_.jpg",Stalker,1979,U,162,"Drama, Sci-Fi",8.2,A guide leads two men through an area known as the Zone to find a room that grants wishes.,Andrei Tarkovsky,Alisa Freyndlikh,Aleksandr Kaydanovskiy,Anatoliy Solonitsyn,Nikolay Grinko,116945,234723.0
"https://m.media-amazon.com/images/M/MV5BZjEyOTE4MzMtNmMzMy00Mzc3LWJlOTQtOGJiNDE0ZmJiOTU4L2ltYWdlXkEyXkFqcGdeQXVyNTAyODkwOQ@@._V1_UY98_CR2,0,67,98_AL_.jpg",The Gold Rush,1925,Passed,95,"Adventure, Comedy, Drama",8.2,A prospector goes to the Klondike in search of gold and finds it and more.,Charles Chaplin,Charles Chaplin,Mack Swain,Tom Murray,Henry Bergman,101053,5450000.0
"https://m.media-amazon.com/images/M/MV5BZWFhOGU5NDctY2Q3YS00Y2VlLWI1NzEtZmIwY2ZiZjY4OTA2XkEyXkFqcGdeQXVyMDI2NDg0NQ@@._V1_UX67_CR0,0,67,98_AL_.jpg",Sherlock Jr.,1924,Passed,45,"Action, Comedy, Romance",8.2,"A film projectionist longs to be a detective, and puts his meagre skills to work when he is framed by a rival for stealing his girlfriend's father's pocketwatch.",Buster Keaton,Buster Keaton,Kathryn McGuire,Joe Keaton,Erwin Connelly,41985,977375.0
"https://m.media-amazon.com/images/M/MV5BNGI1MTI1YTQtY2QwYi00YzUzLTg3NWYtNzExZDlhOTZmZWU0XkEyXkFqcGdeQXVyMDkwNTkwNg@@._V1_UY98_CR3,0,67,98_AL_.jpg",Pink,2016,UA,136,"Drama, Thriller",8.1,"When three young women are implicated in a crime, a retired lawyer steps forward to help them clear their names.",Aniruddha Roy Chowdhury,Taapsee Pannu,Amitabh Bachchan,Kirti Kulhari,Andrea Tariang,39216,1241223.0
"https://m.media-amazon.com/images/M/MV5BMjA1NTEwMDMxMF5BMl5BanBnXkFtZTgwODkzMzI0MjE@._V1_UY98_CR0,0,67,98_AL_.jpg",Haider,2014,UA,160,"Action, Crime, Drama",8.1,"A young man returns to Kashmir after his father's disappearance to confront his uncle, whom he suspects of playing a role in his father's fate.",Vishal Bhardwaj,Shahid Kapoor,Tabu,Shraddha Kapoor,Kay Kay Menon,50445,901610.0
"https://m.media-amazon.com/images/M/MV5BMTYzOTE2NjkxN15BMl5BanBnXkFtZTgwMDgzMTg0MzE@._V1_UY98_CR0,0,67,98_AL_.jpg",PK,2014,UA,153,"Comedy, Drama, Musical",8.1,An alien on Earth loses the only device he can use to communicate with his spaceship. His innocent nature and child-like questions force the country to evaluate the impact of religion on its people.,Rajkumar Hirani,Aamir Khan,Anushka Sharma,Sanjay Dutt,Boman Irani,163061,10616104.0
"https://m.media-amazon.com/images/M/MV5BMGNhYjUwNmYtNDQxNi00NDdmLTljMDAtZWM1NDQyZTk3ZDYwXkEyXkFqcGdeQXVyODE5NzE3OTE@._V1_UY98_CR0,0,67,98_AL_.jpg",OMG: Oh My God!,2012,U,125,"Comedy, Drama, Fantasy",8.1,A shopkeeper takes God to court when his shop is destroyed by an earthquake.,Umesh Shukla,Paresh Rawal,Akshay Kumar,Mithun Chakraborty,Mahesh Manjrekar,51739,923221.0
"https://m.media-amazon.com/images/M/MV5BMTQzMTEyODY2Ml5BMl5BanBnXkFtZTgwMjA0MDUyMjE@._V1_UY98_CR0,0,67,98_AL_.jpg",Barfi!,2012,U,151,"Comedy, Drama, Romance",8.1,Three young people learn that love can neither be defined nor contained by society's definition of normal and abnormal.,Anurag Basu,Ranbir Kapoor,Priyanka Chopra,Ileana D'Cruz,Saurabh Shukla,75721,2804874.0
"https://m.media-amazon.com/images/M/MV5BMTQ1NDI0NzkyOF5BMl5BanBnXkFtZTcwNzAyNzE2Nw@@._V1_UY98_CR0,0,67,98_AL_.jpg",Kahaani,2012,UA,122,"Mystery, Thriller",8.1,"A pregnant woman's search for her missing husband takes her from London to Kolkata, but everyone she questions denies having ever met him.",Sujoy Ghosh,Vidya Balan,Parambrata Chattopadhyay,Indraneil Sengupta,Nawazuddin Siddiqui,57806,1035953.0
"https://m.media-amazon.com/images/M/MV5BZGFmMjM5OWMtZTRiNC00ODhlLThlYTItYTcyZDMyYmMyYjFjXkEyXkFqcGdeQXVyNDUzOTQ5MjY@._V1_UY98_CR0,0,67,98_AL_.jpg",Zindagi Na Milegi Dobara,2011,U,155,"Comedy, Drama",8.1,Three friends decide to turn their fantasy vacation into reality after one of their friends gets engaged.,Zoya Akhtar,Hrithik Roshan,Farhan Akhtar,Abhay Deol,Katrina Kaif,67927,3108485.0
"https://m.media-amazon.com/images/M/MV5BN2ZmMDMwODgtMzA5MS00MGU0LWEyYTgtYzQ5MmQzMzU2NTVkXkEyXkFqcGdeQXVyODE5NzE3OTE@._V1_UY98_CR0,0,67,98_AL_.jpg",Lage Raho Munna Bhai,2006,U,144,"Comedy, Drama, Romance",8.1,Munna Bhai embarks on a journey with Mahatma Gandhi in order to fight against a corrupt property dealer.,Rajkumar Hirani,Sanjay Dutt,Arshad Warsi,Vidya Balan,Boman Irani,43137,2217561.0
"https://m.media-amazon.com/images/M/MV5BMjRjMTYwMTYtMmRkNi00MmVkLWE0MjQtNmM3YjI0NWFhZDNmXkEyXkFqcGdeQXVyODE5NzE3OTE@._V1_UX67_CR0,0,67,98_AL_.jpg",Dil Chahta Hai,2001,Unrated,183,"Comedy, Drama, Romance",8.1,"Three inseparable childhood friends are just out of college. Nothing comes between them - until they each fall in love, and their wildly different approaches to relationships creates tension.",Farhan Akhtar,Aamir Khan,Saif Ali Khan,Akshaye Khanna,Preity Zinta,66803,300000.0
"https://m.media-amazon.com/images/M/MV5BNzI4YTVmMWEtMWQ3MS00OGE1LWE5YjMtNjc4NWJmYjRmZTQyXkEyXkFqcGdeQXVyNTA4NzY1MzY@._V1_UY98_CR0,0,67,98_AL_.jpg",Underground,1995,Not Rated,170,"Comedy, Drama, War",8.1,"A group of Serbian socialists prepares for the war in a surreal underground filled by parties, tragedies, love and hate.",Emir Kusturica,Predrag 'Miki' Manojlovic,Lazar Ristovski,Mirjana Jokovic,Slavko Stimac,55220,171082.0
"https://m.media-amazon.com/images/M/MV5BNDNiOTA5YjktY2Q0Ni00ODgzLWE5MWItNGExOWRlYjY2MjBlXkEyXkFqcGdeQXVyNjQ2MjQ5NzM@._V1_UY98_CR1,0,67,98_AL_.jpg",La haine,1995,UA,98,"Crime, Drama",8.1,24 hours in the lives of three young men in the French suburbs the day after a violent riot.,Mathieu Kassovitz,Vincent Cassel,Hubert Koundé,Saïd Taghmaoui,Abdel Ahmed Ghili,150345,309811.0
"https://m.media-amazon.com/images/M/MV5BYmFhZmM3Y2MtNDA1Ny00NjkzLWJkM2EtYWU1ZjEwYmNjZDQ0XkEyXkFqcGdeQXVyMTMxMTY0OTQ@._V1_UX67_CR0,0,67,98_AL_.jpg",Ba wang bie ji,1993,R,171,"Drama, Music, Romance",8.1,Two boys meet at an opera training school in Peking in 1924. Their resulting friendship will span nearly 70 years and will endure some of the most troublesome times in China's history.,Kaige Chen,Leslie Cheung,Fengyi Zhang,Gong Li,You Ge,25088,5216888.0
"https://m.media-amazon.com/images/M/MV5BMjEzNjY5NDcwNV5BMl5BanBnXkFtZTcwNzEwMzg4NA@@._V1_UX67_CR0,0,67,98_AL_.jpg",Dà hóng denglong gaogao guà,1991,PG,125,"Drama, History, Romance",8.1,"A young woman becomes the fourth wife of a wealthy lord, and must learn to live with the strict rules and tensions within the household.",Yimou Zhang,Gong Li,Jingwu Ma,Saifei He,Cuifen Cao,29662,2603061.0
"https://m.media-amazon.com/images/M/MV5BMTg1MDg3OTk3M15BMl5BanBnXkFtZTgwMDEzMzE5MTE@._V1_UY98_CR0,0,67,98_AL_.jpg",Zerkalo,1975,G,107,"Biography, Drama",8.1,"A dying man in his forties remembers his past. His childhood, his mother, the war, personal moments and things that tell of the recent history of all the Russian nation.",Andrei Tarkovsky,Margarita Terekhova,Filipp Yankovskiy,Ignat Daniltsev,Oleg Yankovskiy,40081,177345.0
"https://m.media-amazon.com/images/M/MV5BMTg3NzYzOTEtNmE2Ni00M2EyLWJhMjctNjMyMTk4ZTViOGUzXkEyXkFqcGdeQXVyNzQxNDExNTU@._V1_UY98_CR0,0,67,98_AL_.jpg",Viskningar och rop,1972,A,91,Drama,8.1,"When a woman dying of cancer in early twentieth-century Sweden is visited by her two sisters, long-repressed feelings between the siblings rise to the surface.",Ingmar Bergman,Harriet Andersson,Liv Ullmann,Kari Sylwan,Ingrid Thulin,30206,1742348.0
"https://m.media-amazon.com/images/M/MV5BMWFjZjRiM2QtZmRkOC00MDUxLTlhYmQtYmY5ZTNiMTI5Nzc2L2ltYWdlXkEyXkFqcGdeQXVyNTAyODkwOQ@@._V1_UX67_CR0,0,67,98_AL_.jpg",Le samouraï,1967,GP,105,"Crime, Drama, Mystery",8.1,After professional hitman Jef Costello is seen by witnesses his efforts to provide himself an alibi drive him further into a corner.,Jean-Pierre Melville,Alain Delon,François Périer,Nathalie Delon,Cathy Rosier,45434,39481.0
"https://m.media-amazon.com/images/M/MV5BNjM2MjMwNzUzN15BMl5BanBnXkFtZTgwMjEzMzE5MTE@._V1_UY98_CR2,0,67,98_AL_.jpg",Andrei Rublev,1966,R,205,"Biography, Drama, History",8.1,"The life, times and afflictions of the fifteenth-century Russian iconographer St. Andrei Rublev.",Andrei Tarkovsky,Anatoliy Solonitsyn,Ivan Lapikov,Nikolay Grinko,Nikolay Sergeev,46947,102021.0
"https://m.media-amazon.com/images/M/MV5BZjgyMzZkMGUtNTBhZC00OTkzLWI4ZmMtYzcwMzc5MjQ0YTM3XkEyXkFqcGdeQXVyMTMxMTY0OTQ@._V1_UY98_CR3,0,67,98_AL_.jpg",Jungfrukällan,1960,A,89,Drama,8.1,"An innocent yet pampered young virgin and her family's pregnant and jealous servant set out to deliver candles to church, but only one returns from events that transpire in the woods along the way.",Ingmar Bergman,Max von Sydow,Birgitta Valberg,Gunnel Lindblom,Birgitta Pettersson,26697,1526000.0
"https://m.media-amazon.com/images/M/MV5BOTdhNmUxZmQtNmMwNC00MzE3LWE1MTUtZDgxZTYwYjEzZjcwXkEyXkFqcGdeQXVyNTA1NjYyMDk@._V1_UY98_CR0,0,67,98_AL_.jpg",Le notti di Cabiria,1957,Not Rated,110,Drama,8.1,A waifish prostitute wanders the streets of Rome looking for true love but finds only heartbreak.,Federico Fellini,Giulietta Masina,François Périer,Franca Marzi,Dorian Gray,42940,752045.0
"https://m.media-amazon.com/images/M/MV5BOWRmNGEwZjUtZjEwNS00OGZmLThhMmEtZTJlMTU5MGQ3ZWUwXkEyXkFqcGdeQXVyNjc1NTYyMjg@._V1_UX67_CR0,0,67,98_AL_.jpg",The Red Shoes,1948,Not Rated,135,"Drama, Music, Romance",8.1,A young ballet dancer is torn between the man she loves and her pursuit to become a prima ballerina.,Michael Powell,Emeric Pressburger,Anton Walbrook,Marius Goring,Moira Shearer,30935,10900000.0
"https://m.media-amazon.com/images/M/MV5BMTg3MTI5NTk0N15BMl5BanBnXkFtZTgwMjU1MDM5MTE@._V1_UY98_CR2,0,67,98_AL_.jpg",La Grande Illusion,1937,Not Rated,113,"Drama, War",8.1,"During WWI, two French soldiers are captured and imprisoned in a German P.O.W. camp. Several escape attempts follow until they are eventually sent to a seemingly inescapable fortress.",Jean Renoir,Jean Gabin,Dita Parlo,Pierre Fresnay,Erich von Stroheim,33829,172885.0
"https://m.media-amazon.com/images/M/MV5BNjBjNDJiYTUtOWY0OS00OGVmLTg2YzctMTE0NzVhODM1ZWJmXkEyXkFqcGdeQXVyNjU0OTQ0OTY@._V1_UX67_CR0,0,67,98_AL_.jpg",La passion de Jeanne d'Arc,1928,Passed,110,"Biography, Drama, History",8.1,"In 1431, Jeanne d'Arc is placed on trial on charges of heresy. The ecclesiastical jurists attempt to force Jeanne to recant her claims of holy visions.",Carl Theodor Dreyer,Maria Falconetti,Eugene Silvain,André Berley,Maurice Schutz,47676,21877.0
"https://m.media-amazon.com/images/M/MV5BNDVkYmYwM2ItNzRiMy00NWQ4LTlhMjMtNDI1ZDYyOGVmMzJjXkEyXkFqcGdeQXVyNTgzMzU5MDI@._V1_UX67_CR0,0,67,98_AL_.jpg",Sunrise: A Song of Two Humans,1927,Passed,94,"Drama, Romance",8.1,An allegorical tale about a man fighting the good and evil within him. Both sides are made flesh - one a sophisticated woman he is attracted to and the other his wife.,F.W. Murnau,George O'Brien,Janet Gaynor,Margaret Livingston,Bodil Rosing,46865,539540.0
"https://m.media-amazon.com/images/M/MV5BYmRiMDFlYjYtOTMwYy00OGY2LWE0Y2QtYzQxOGNhZmUwNTIxXkEyXkFqcGdeQXVyNzkwMjQ5NzM@._V1_UX67_CR0,0,67,98_AL_.jpg",The General,1926,Passed,67,"Action, Adventure, Comedy",8.1,"When Union spies steal an engineer's beloved locomotive, he pursues it single-handedly and straight through enemy lines.",Clyde Bruckman,Buster Keaton,Buster Keaton,Marion Mack,Glen Cavender,81156,1033895.0
"https://m.media-amazon.com/images/M/MV5BMjE1NjQ5ODc2NV5BMl5BanBnXkFtZTgwOTM5ODIxNjE@._V1_UY98_CR0,0,67,98_AL_.jpg",Bajrangi Bhaijaan,2015,UA,163,"Action, Adventure, Comedy",8.0,An Indian man with a magnanimous heart takes a young mute Pakistani girl back to her homeland to reunite her with her family.,Kabir Khan,Salman Khan,Harshaali Malhotra,Nawazuddin Siddiqui,Kareena Kapoor,72245,8178001.0
"https://m.media-amazon.com/images/M/MV5BYWVlMjVhZWYtNWViNC00ODFkLTk1MmItYjU1MDY5ZDdhMTU3XkEyXkFqcGdeQXVyODIwMDI1NjM@._V1_UX67_CR0,0,67,98_AL_.jpg",Bãhubali: The Beginning,2015,UA,159,"Action, Drama",8.0,"In ancient India, an adventurous and daring man becomes involved in a decades-old feud between two warring peoples.",S.S. Rajamouli,Prabhas,Rana Daggubati,Ramya Krishnan,Sathyaraj,102972,6738000.0
"https://m.media-amazon.com/images/M/MV5BMTQ1NDI5MjMzNF5BMl5BanBnXkFtZTcwMTc0MDQwOQ@@._V1_UY98_CR0,0,67,98_AL_.jpg",Special Chabbis,2013,UA,144,"Crime, Drama, Thriller",8.0,A gang of con-men rob prominent rich businessmen and politicians by posing as C.B.I and income tax officers.,Neeraj Pandey,Akshay Kumar,Anupam Kher,Manoj Bajpayee,Jimmy Sheirgill,51069,1079369.0
"https://m.media-amazon.com/images/M/MV5BYjU1NjczNzYtYmFjOC00NzkxLTg4YTUtNGYzMTk3NTU0ZDE3XkEyXkFqcGdeQXVyNDUzOTQ5MjY@._V1_UY98_CR0,0,67,98_AL_.jpg",Dev.D,2009,A,144,"Drama, Romance",8.0,"After breaking up with his childhood sweetheart, a young man finds solace in drugs. Meanwhile, a teenage girl is caught in the world of prostitution. Will they be destroyed, or will they find redemption?",Anurag Kashyap,Abhay Deol,Mahie Gill,Kalki Koechlin,Dibyendu Bhattacharya,28749,10950.0
"https://m.media-amazon.com/images/M/MV5BMmMzOWNhNTYtYmY0My00OGJiLWIzNDUtZWRhNGY0NWFjNzFmXkEyXkFqcGdeQXVyNjUxMDQ0MTg@._V1_UX67_CR0,0,67,98_AL_.jpg",Pâfekuto burû,1997,A,81,"Animation, Crime, Mystery",8.0,"A pop singer gives up her career to become an actress, but she slowly goes insane when she starts being stalked by an obsessed fan and what seems to be a ghost of her past.",Satoshi Kon,Junko Iwao,Rica Matsumoto,Shinpachi Tsuji,Masaaki Ôkura,58192,776665.0
"https://m.media-amazon.com/images/M/MV5BMTk2MjcxNjMzN15BMl5BanBnXkFtZTgwMTE3OTEwNjE@._V1_UY98_CR3,0,67,98_AL_.jpg",Knockin' on Heaven's Door,1997,Not Rated,87,"Action, Crime, Comedy",8.0,"Two terminally ill patients escape from a hospital, steal a car and rush towards the sea.",Thomas Jahn,Til Schweiger,Jan Josef Liefers,Thierry van Werveke,Moritz Bleibtreu,27721,3296.0
"https://m.media-amazon.com/images/M/MV5BM2ZiZTk1ODgtMTZkNS00NTYxLWIxZTUtNWExZGYwZTRjODViXkEyXkFqcGdeQXVyMTE2MzA3MDM@._V1_UX67_CR0,0,67,98_AL_.jpg",Akira,1988,UA,124,"Animation, Action, Sci-Fi",8.0,A secret military project endangers Neo-Tokyo when it turns a biker gang member into a rampaging psychic psychopath who can only be stopped by two teenagers and a group of psychics.,Katsuhiro Ôtomo,Mitsuo Iwata,Nozomu Sasaki,Mami Koyama,Tesshô Genda,164918,553171.0
"https://m.media-amazon.com/images/M/MV5BM2EzZmFmMmItODY3Zi00NjdjLWE0MTYtZWQ3MGIyM2M4YjZhXkEyXkFqcGdeQXVyMzg2MzE2OTE@._V1_UX67_CR0,0,67,98_AL_.jpg",Sleuth,1972,PG,138,"Mystery, Thriller",8.0,"A man who loves games and theater invites his wife's lover to meet him, setting up a battle of wits with potentially deadly results.",Joseph L. Mankiewicz,Laurence Olivier,Michael Caine,Alec Cawthorne,John Matthews,44748,4081254.0
"https://m.media-amazon.com/images/M/MV5BYjkxOGM5OTktNTRmZi00MjhlLWE2MDktNzY3NjY3NmRjNDUyXkEyXkFqcGdeQXVyNDY2MTk1ODk@._V1_UX67_CR0,0,67,98_AL_.jpg",Laura,1944,Passed,88,"Drama, Film-Noir, Mystery",8.0,A police detective falls in love with the woman whose murder he is investigating.,Otto Preminger,Gene Tierney,Dana Andrews,Clifton Webb,Vincent Price,42725,4360000.0
"https://m.media-amazon.com/images/M/MV5BYmIzYmY4MGItM2I4YS00OWZhLWFmMzQtYzI2MWY1MmM3NGU1XkEyXkFqcGdeQXVyNjQ2MjQ5NzM@._V1_UY98_CR0,0,67,98_AL_.jpg",Jab We Met,2007,U,138,"Comedy, Drama, Romance",7.9,A depressed wealthy businessman finds his life changing after he meets a spunky and care-free young woman.,Imtiaz Ali,Shahid Kapoor,Kareena Kapoor,Tarun Arora,Dara Singh,47720,410800.0
"https://m.media-amazon.com/images/M/MV5BMTkzNzYyMzA5N15BMl5BanBnXkFtZTgwODcwODQ3MDI@._V1_UX67_CR0,0,67,98_AL_.jpg",The Lion in Winter,1968,PG,134,"Biography, Drama, History",7.9,"1183 A.D.: King Henry II's three sons all want to inherit the throne, but he won't commit to a choice. They and his wife variously plot to force him.",Anthony Harvey,Peter O'Toole,Katharine Hepburn,Anthony Hopkins,John Castle,29003,22276975.0
"https://m.media-amazon.com/images/M/MV5BMzY2NTA1MzUwN15BMl5BanBnXkFtZTgwOTc4NTU4MjE@._V1_UX67_CR0,0,67,98_AL_.jpg",Hiroshima mon amour,1959,Not Rated,90,"Drama, Romance",7.9,A French actress filming an anti-war film in Hiroshima has an affair with a married Japanese architect as they share their differing perspectives on war.,Alain Resnais,Emmanuelle Riva,Eiji Okada,Stella Dassas,Pierre Barbaud,28421,88300.0
