Poster_Link,Series_Title,Released_Year,Certificate,Runtime,Genre,IMDB_Rating,Overview,Director,Star1,Star2,Star3,Star4,No_of_Votes,Gross
"https://m.media-amazon.com/images/M/MV5BODcxYjUxZDgtYTQ5Zi00YmQ1LWJmZmItODZkOTYyNDhiNWM3XkEyXkFqcGdeQXVyNjc1NTYyMjg@._V1_UX67_CR0,0,67,98_AL_.jpg",The Ten Commandments,1956,U,220,"Adventure, Drama",7.9,"Moses, an Egyptian Prince, learns of his true heritage as a Hebrew and his divine mission as the deliverer of his people.",Cecil B. DeMille,Charlton Heston,Yul Brynner,Anne Baxter,Edward G. Robinson,63560,93740000.0
"https://m.media-amazon.com/images/M/MV5BMjdiM2IyZmQtODJiYy00NDNkLTllYmItMmFjMDNiYTQyOGVkXkEyXkFqcGdeQXVyNDY2MTk1ODk@._V1_UX67_CR0,0,67,98_AL_.jpg",The Big Sleep,1946,Passed,114,"Crime, Film-Noir, Mystery",7.9,"Private detective Philip Marlowe is hired by a wealthy family. Before the complex case is over, he's seen murder, blackmail, and what might be love.",Howard Hawks,Humphrey Bogart,Lauren Bacall,John Ridgely,Martha Vickers,78796,6540000.0
"https://m.media-amazon.com/images/M/MV5BMTk4NDQ0NjgyNF5BMl5BanBnXkFtZTgwMTE3NTkxMTE@._V1_UX67_CR0,0,67,98_AL_.jpg",The Lost Weekend,1945,Passed,101,"Drama, Film-Noir",7.9,The desperate life of a chronic alcoholic is followed through a four-day drinking bout.,Billy Wilder,Ray Milland,Jane Wyman,Phillip Terry,Howard Da Silva,33549,9460000.0
"https://m.media-amazon.com/images/M/MV5BZDVmZTZkYjMtNmViZC00ODEzLTgwNDAtNmQ3OGQwOWY5YjFmXkEyXkFqcGdeQXVyNDY2MTk1ODk@._V1_UX67_CR0,0,67,98_AL_.jpg",His Girl Friday,1940,Passed,92,"Comedy, Drama, Romance",7.9,A newspaper editor uses every trick in the book to keep his ace reporter ex-wife from remarrying.,Howard Hawks,Cary Grant,Rosalind Russell,Ralph Bellamy,Gene Lockhart,53667,296000.0
"https://m.media-amazon.com/images/M/MV5BYTJmNmQxNGItNDNlMC00MDU3LWFhNzMtZDQ2NDY0ZTVkNjE3XkEyXkFqcGdeQXVyMDI2NDg0NQ@@._V1_UX67_CR0,0,67,98_AL_.jpg",A Night at the Opera,1935,Passed,96,"Comedy, Music, Musical",7.9,A sly business manager and two wacky friends of two opera singers help them achieve success while humiliating their stuffy and snobbish enemies.,Sam Wood,Edmund Goulding,Groucho Marx,Chico Marx,Harpo Marx,30580,2537520.0
"https://m.media-amazon.com/images/M/MV5BZjAzZjZiMmQtMDZmOC00NjVmLTkyNTItOGI2Mzg4NTBhZTA1XkEyXkFqcGdeQXVyODE5NzE3OTE@._V1_UY98_CR0,0,67,98_AL_.jpg",M.S. Dhoni: The Untold Story,2016,U,184,"Biography, Drama, Sport",7.8,The untold story of Mahendra Singh Dhoni's journey from ticket collector to trophy collector - the world-cup-winning captain of the Indian Cricket Team.,Neeraj Pandey,Sushant Singh Rajput,Kiara Advani,Anupam Kher,Disha Patani,40416,1782795.0
"https://m.media-amazon.com/images/M/MV5BYWNlODE1ZTEtOTQ5MS00N2QwLTllNjItZDQ2Y2UzMmU5YmI2XkEyXkFqcGdeQXVyODE5NzE3OTE@._V1_UY98_CR3,0,67,98_AL_.jpg",Vicky Donor,2012,UA,126,"Comedy, Romance",7.8,"A man is brought in by an infertility doctor to supply him with his sperm, where he becomes the biggest sperm donor for his clinic.",Shoojit Sircar,Ayushmann Khurrana,Yami Gautam,Annu Kapoor,Dolly Ahluwalia,39710,169209.0
"https://m.media-amazon.com/images/M/MV5BMjQ5YWVmYmYtOWFiZC00NGMxLWEwODctZDM2MWI4YWViN2E5XkEyXkFqcGdeQXVyNjQ2MjQ5NzM@._V1_UY98_CR0,0,67,98_AL_.jpg",English Vinglish,2012,U,134,"Comedy, Drama, Family",7.8,"A quiet, sweet tempered housewife endures small slights from her well-educated husband and daughter every day because of her inability to speak and understand English.",Gauri Shinde,Sridevi,Adil Hussain,Mehdi Nebbou,Priya Anand,33618,1670773.0
"https://m.media-amazon.com/images/M/MV5BMTgzMTkxNjAxNV5BMl5BanBnXkFtZTgwMDU3MDE0MjE@._V1_UY98_CR0,0,67,98_AL_.jpg",Ajeossi,2010,R,119,"Action, Crime, Drama",7.8,A quiet pawnshop keeper with a violent past takes on a drug-and-organ trafficking ring in hope of saving the child who is his only friend.,Jeong-beom Lee,Won Bin,Sae-ron Kim,Tae-hoon Kim,Hee-won Kim,62848,6460.0
"https://m.media-amazon.com/images/M/MV5BODk4MzE5NjgtN2ZhOS00YTdkLTg0YzktMmE1MTkxZmMyMWI2L2ltYWdlXkEyXkFqcGdeQXVyNTAyODkwOQ@@._V1_UX67_CR0,0,67,98_AL_.jpg",Hana-bi,1997,Not Rated,103,"Crime, Drama, Romance",7.8,"Nishi leaves the police in the face of harrowing personal and professional difficulties. Spiraling into depression, he makes questionable decisions.",Takeshi Kitano,Takeshi Kitano,Kayoko Kishimoto,Ren Osugi,Susumu Terajima,27712,233986.0
"https://m.media-amazon.com/images/M/MV5BYTRiMWM3MGItNjAxZC00M2E3LThhODgtM2QwOGNmZGU4OWZhXkEyXkFqcGdeQXVyNjExODE1MDc@._V1_UX67_CR0,0,67,98_AL_.jpg",Batman: Mask of the Phantasm,1993,PG,76,"Animation, Action, Crime",7.8,Batman is wrongly implicated in a series of murders of mob bosses actually done by a new vigilante assassin.,Kevin Altieri,Boyd Kirkland,Frank Paur,Dan Riba,Eric Radomski,43690,5617391.0
"https://m.media-amazon.com/images/M/MV5BNzk5MDk2MjktY2I3NS00ODZkLTk3OTktY2Q3ZDE2MmQ2M2ZmXkEyXkFqcGdeQXVyNjc1NTYyMjg@._V1_UY98_CR2,0,67,98_AL_.jpg",À bout de souffle,1960,U,90,"Crime, Drama",7.8,"A small-time thief steals a car and impulsively murders a motorcycle policeman. Wanted by the authorities, he reunites with a hip American journalism student and attempts to persuade her to run away with him to Italy.",Jean-Luc Godard,Jean-Paul Belmondo,Jean Seberg,Daniel Boulanger,Henri-Jacques Huet,73251,336705.0
"https://m.media-amazon.com/images/M/MV5BOTc3NzAxMjg4M15BMl5BanBnXkFtZTcwMDc2ODQwNw@@._V1_UY98_CR3,0,67,98_AL_.jpg",Rockstar,2011,UA,159,"Drama, Music, Musical",7.7,"Janardhan Jakhar chases his dreams of becoming a big Rock star, during which he falls in love with Heer.",Imtiaz Ali,Ranbir Kapoor,Nargis Fakhri,Shammi Kapoor,Kumud Mishra,39501,985912.0
"https://m.media-amazon.com/images/M/MV5BYjA2MTA1MjUtYmUyNy00NGZiLTk2NTAtMDk3N2M3YmMwOTc1XkEyXkFqcGdeQXVyMjA0MzYwMDY@._V1_UY98_CR0,0,67,98_AL_.jpg",Abre los ojos,1997,U,119,"Drama, Mystery, Sci-Fi",7.7,"A very handsome man finds the love of his life, but he suffers an accident and needs to have his face rebuilt by surgery after it is severely disfigured.",Alejandro Amenábar,Eduardo Noriega,Penélope Cruz,Chete Lera,Fele Martínez,64082,368234.0
"https://m.media-amazon.com/images/M/MV5BM2U5OWM5NWQtZDYwZS00NmI3LTk4NDktNzcwZjYzNmEzYWU1XkEyXkFqcGdeQXVyNjMwMjk0MTQ@._V1_UY98_CR0,0,67,98_AL_.jpg",Hamlet,1996,PG-13,242,Drama,7.7,"Hamlet, Prince of Denmark, returns home to find his father murdered and his mother remarrying the murderer, his uncle. Meanwhile, war is brewing.",Kenneth Branagh,Kenneth Branagh,Julie Christie,Derek Jacobi,Kate Winslet,35991,4414535.0
"https://m.media-amazon.com/images/M/MV5BMGUwMjM0MTEtOGY2NS00MjJmLWEyMDAtYmNkMWJjOWJlNGM0XkEyXkFqcGdeQXVyMTQxNzMzNDI@._V1_UX67_CR0,0,67,98_AL_.jpg",Zelig,1983,PG,79,Comedy,7.7,"""Documentary"" about a man who can look and act like whoever he's around, and meets various famous people.",Woody Allen,Woody Allen,Mia Farrow,Patrick Horgan,John Buckwalter,39881,11798616.0
"https://m.media-amazon.com/images/M/MV5BZjNkNGJjYWEtM2IyNi00ZjM5LWFlYjYtYjQ4NTU5MGFlMTI2XkEyXkFqcGdeQXVyMTMxMTY0OTQ@._V1_UY98_CR3,0,67,98_AL_.jpg",Belle de jour,1967,A,100,"Drama, Romance",7.7,A frigid young housewife decides to spend her midweek afternoons as a prostitute.,Luis Buñuel,Catherine Deneuve,Jean Sorel,Michel Piccoli,Geneviève Page,40274,26331.0
"https://m.media-amazon.com/images/M/MV5BZjM3ZTAzZDYtZmFjZS00YmQ1LWJlOWEtN2I4MDRmYzY5YmRlL2ltYWdlXkEyXkFqcGdeQXVyMjgyNjk3MzE@._V1_UX67_CR0,0,67,98_AL_.jpg",Peeping Tom,1960,Not Rated,101,"Drama, Horror, Thriller",7.7,"A young man murders women, using a movie camera to film their dying expressions of terror.",Michael Powell,Karlheinz Böhm,Anna Massey,Moira Shearer,Maxine Audley,31354,83957.0
"https://m.media-amazon.com/images/M/MV5BMWM1ZDhlM2MtNDNmMi00MDk4LTg5MjgtODE4ODk1MjYxOTIwXkEyXkFqcGdeQXVyNjc0MzMzNjA@._V1_UX67_CR0,0,67,98_AL_.jpg",The Quiet Man,1952,Passed,129,"Comedy, Drama, Romance",7.7,"A retired American boxer returns to the village of his birth in Ireland, where he falls for a spirited redhead whose brother is contemptuous of their union.",John Ford,John Wayne,Maureen O'Hara,Barry Fitzgerald,Ward Bond,34677,10550000.0
